{
  "$schema": "../../schemas/slide-spec.schema.json",
  "schemaVersion": "1.0",
  "episodeId": "2026-08-04-pilot",
  "title": "危機対応のツケは誰が払う？",
  "subtitle": "戦争・円・消費税から見る、守られる人と負担する人",
  "date": "2026-08-04",
  "status": "outline-ready",
  "estimatedDurationSec": 1800,
  "slideCount": 20,
  "theme": {
    "name": "dark-newsroom",
    "aspectRatio": "16:9",
    "canvas": {
      "width": 1920,
      "height": 1080
    },
    "fonts": {
      "primary": "Noto Sans JP",
      "fallback": [
        "Arial",
        "sans-serif"
      ]
    },
    "colors": {
      "background": "#11151B",
      "text": "#F4F6F8",
      "chinaAi": "#E44D5E",
      "americaAi": "#4B8BFF",
      "human": "#F2C94C",
      "verified": "#38B27A",
      "estimate": "#E6B84A",
      "unverified": "#B58CFF",
      "correction": "#FF8A4C"
    },
    "safeAreas": {
      "sourceStripHeightPx": 60,
      "subtitleOverlayReservePx": 140
    }
  },
  "generation": {
    "target": "Google Slides",
    "editableShapesPreferred": true,
    "speakerNotesIncludeFullSources": true,
    "imagePolicy": {
      "victimPhotos": "forbidden",
      "personPhotos": "official-or-clearly-licensed",
      "fallback": "name-and-silhouette",
      "mapsAndDiagrams": "prefer-editable-vectors"
    }
  },
  "contentRules": {
    "oneThesisPerSlide": true,
    "maxBodyItems": 5,
    "sourceStripRequiredWhenSourced": true,
    "statusBadgeVocabulary": [
      "verified",
      "estimate",
      "unverified",
      "correction"
    ],
    "speakerIds": [
      "china_ai",
      "america_ai",
      "human_cue"
    ]
  },
  "slides": [
    {
      "id": "s001",
      "kind": "title",
      "durationSec": 45,
      "title": "危機対応のツケは誰が払う？",
      "subtitle": "戦争・円・消費税から見る、守られる人と負担する人",
      "badges": [],
      "onScreen": [
        "政経ニュースコーナー",
        "2026年8月4日"
      ],
      "visuals": [
        {
          "type": "connected-icons",
          "items": [
            "タンカー",
            "円マーク",
            "買い物かご"
          ],
          "background": [
            "薄い世界地図",
            "日本列島"
          ],
          "characters": [
            "china_ai:left-bottom",
            "human:center-bottom",
            "america_ai:right-bottom"
          ]
        }
      ],
      "speakerFlow": [
        {
          "speaker": "china_ai",
          "purpose": "今日のテーマを端的に紹介"
        },
        {
          "speaker": "america_ai",
          "purpose": "危機にも値札が付くという角度で受ける"
        },
        {
          "speaker": "human_cue",
          "purpose": "番組の狙いを一言で説明"
        }
      ],
      "humanCue": "戦争、為替、税制を『誰が負担するか』という一本の問いで見ると宣言する。",
      "sources": [],
      "notes": [],
      "updateBeforeRecording": false
    },
    {
      "id": "s002",
      "kind": "agenda",
      "durationSec": 45,
      "title": "今日の重大ニュースは3本",
      "badges": [],
      "onScreen": [
        "ホルムズ海峡――戦争が電気代へ届くまで",
        "日米の円買い介入――自由市場を政府が救う日",
        "食料品消費税1％案――減税と制度コスト",
        "こぼれ話：山本太郎／ひろゆき新党構想／首相／警察／国旗／関税"
      ],
      "visuals": [
        {
          "type": "agenda-cards",
          "majorCards": 3,
          "minorTicker": true
        }
      ],
      "speakerFlow": [
        {
          "speaker": "america_ai",
          "purpose": "重大3本を短く列挙"
        },
        {
          "speaker": "china_ai",
          "purpose": "後半は統治の雑さも見ると予告"
        },
        {
          "speaker": "human_cue",
          "purpose": "全体の尺と進行を案内"
        }
      ],
      "humanCue": "重大ニュースを先に、後半にこぼれ話をまとめて扱うと説明する。",
      "sources": [],
      "notes": [],
      "updateBeforeRecording": false
    },
    {
      "id": "s003",
      "kind": "thesis-flow",
      "durationSec": 60,
      "title": "危機対応のコストは消えない。移る。",
      "badges": [],
      "onScreen": [
        "戦争・制裁 → 輸送・保険コスト",
        "原油・円相場 → 物価・生活費",
        "減税・給付・金利 → 家計・事業者・将来世代"
      ],
      "visuals": [
        {
          "type": "flow",
          "nodes": [
            "戦争・制裁",
            "輸送・保険",
            "原油・円",
            "物価・生活費",
            "減税・給付・金利"
          ],
          "branches": [
            "家計",
            "事業者",
            "将来世代"
          ]
        }
      ],
      "speakerFlow": [
        {
          "speaker": "china_ai",
          "purpose": "負担の移転を説明"
        },
        {
          "speaker": "america_ai",
          "purpose": "市場価格は負担の行き先を可視化すると補足"
        },
        {
          "speaker": "human_cue",
          "purpose": "誰へ移ったかを追うと宣言"
        }
      ],
      "humanCue": "ニュースごとに『負担が消えたか』ではなく『誰へ移ったか』を見る。",
      "sources": [],
      "notes": [],
      "updateBeforeRecording": false
    },
    {
      "id": "s004",
      "kind": "map-and-status",
      "durationSec": 120,
      "title": "交渉はあるのか、ないのか",
      "badges": [
        {
          "label": "確認済み・当事者主張を分離",
          "status": "verified"
        }
      ],
      "onScreen": [
        "米国側：交渉は進んでいる（当事者の主張）",
        "イラン側：交渉はない（当事者の主張）",
        "貨物船が飛来物で被弾（確認済み）",
        "攻撃主体は未確定",
        "約6,000人の船員が足止め"
      ],
      "visuals": [
        {
          "type": "regional-map",
          "regions": [
            "イラン",
            "オマーン",
            "UAE",
            "ホルムズ海峡"
          ],
          "markers": [
            {
              "kind": "warning-unknown",
              "label": "被弾地点"
            }
          ]
        },
        {
          "type": "status-cards",
          "statuses": [
            "当事者の主張",
            "確認済み",
            "未確認"
          ]
        }
      ],
      "speakerFlow": [
        {
          "speaker": "america_ai",
          "purpose": "確認済み事実を説明"
        },
        {
          "speaker": "china_ai",
          "purpose": "両国の発言を事実と混同しないよう整理"
        },
        {
          "speaker": "human_cue",
          "purpose": "交渉発表をどこまで信用するか問う"
        }
      ],
      "humanCue": "『交渉している』という発表を、市民や市場はどこまで信用してよいか。",
      "sourceLabel": "出典: IMO (2026-07-08), Reuters (2026-08-04)",
      "sources": [
        {
          "name": "IMO",
          "date": "2026-07-08",
          "url": "https://www.imo.org/en/mediacentre/secretarygeneral/pages/new-attacks-on-ships-in-the-strait-of-hormuz.aspx",
          "strength": "A"
        },
        {
          "name": "Reuters",
          "date": "2026-08-04",
          "url": "https://www.reuters.com/world/middle-east/status-us-iran-talks-uncertain-ship-struck-hormuz-2026-08-04/",
          "strength": "B"
        }
      ],
      "notes": [
        "攻撃主体をイランと断定しない",
        "海峡を完全封鎖と表現しない",
        "民間船舶への攻撃は両AIとも正当化しない"
      ],
      "updateBeforeRecording": true,
      "dynamicTokens": {
        "usIranTalkStatus": {
          "type": "string",
          "required": true
        },
        "shipAttackAttribution": {
          "type": "string",
          "required": true
        }
      }
    },
    {
      "id": "s005",
      "kind": "big-number-flow",
      "durationSec": 90,
      "title": "日本の原油、中東依存 約95.1％",
      "badges": [
        {
          "label": "2024年度速報",
          "status": "verified"
        }
      ],
      "onScreen": [
        "95.1%",
        "原油 → 海上保険・運賃 → ガソリン・電気・物流・食品",
        "2026年3月、国家備蓄原油を放出"
      ],
      "visuals": [
        {
          "type": "big-number",
          "value": "95.1%",
          "caption": "日本の原油輸入に占める中東地域"
        },
        {
          "type": "supply-chain",
          "nodes": [
            "ホルムズ海峡",
            "タンカー",
            "日本",
            "生活費"
          ]
        }
      ],
      "speakerFlow": [
        {
          "speaker": "china_ai",
          "purpose": "エネルギー依存を公共政策の問題として説明"
        },
        {
          "speaker": "america_ai",
          "purpose": "備蓄は時間を買うが供給源ではないと補足"
        },
        {
          "speaker": "human_cue",
          "purpose": "ガソリン・電気代の実感を話す"
        }
      ],
      "humanCue": "最近のガソリン代や電気代で、中東情勢が生活へ届く感覚があったか。",
      "sourceLabel": "出典: 資源エネルギー庁、経済産業省",
      "sources": [
        {
          "name": "資源エネルギー庁",
          "url": "https://www.enecho.meti.go.jp/about/special/johoteikyo/energyissue2025_1.html",
          "strength": "A"
        },
        {
          "name": "経済産業省",
          "date": "2026-03-24",
          "url": "https://www.meti.go.jp/press/2025/03/20260324004/20260324004.html",
          "strength": "A"
        }
      ],
      "notes": [],
      "updateBeforeRecording": false
    },
    {
      "id": "s006",
      "kind": "two-perspectives",
      "durationSec": 120,
      "title": "抑止力か、介入が生む不安定化か",
      "badges": [],
      "onScreen": [
        "中華AI：軍事介入と制裁が交渉余地を狭める",
        "メリケンAI：航行の自由と核拡散防止には抑止も必要",
        "共通項：民間船舶への攻撃は正当化しない"
      ],
      "visuals": [
        {
          "type": "two-column-debate",
          "left": {
            "speaker": "china_ai",
            "points": [
              "軍事介入",
              "制裁",
              "資源輸送路の圧力装置化"
            ]
          },
          "right": {
            "speaker": "america_ai",
            "points": [
              "航行の自由",
              "核拡散防止",
              "政権の予測不能性"
            ]
          },
          "common": "民間船舶への攻撃は正当化しない"
        }
      ],
      "speakerFlow": [
        {
          "speaker": "china_ai",
          "purpose": "介入が生む不安定化を論じる"
        },
        {
          "speaker": "america_ai",
          "purpose": "抑止の必要性と米政権の予測不能性を論じる"
        },
        {
          "speaker": "china_ai",
          "purpose": "妥当な点を認め日本の備えへ接続"
        },
        {
          "speaker": "human_cue",
          "purpose": "日本の備えを問う"
        }
      ],
      "humanCue": "日本は中東依存を減らすと言い続けてきたが、生活を守る備えは進んだと感じるか。",
      "sourceLabel": "出典: IMO, Reuters, 資源エネルギー庁",
      "sources": [
        {
          "name": "IMO",
          "date": "2026-07-08",
          "url": "https://www.imo.org/en/mediacentre/secretarygeneral/pages/new-attacks-on-ships-in-the-strait-of-hormuz.aspx",
          "strength": "A"
        },
        {
          "name": "Reuters",
          "date": "2026-08-04",
          "url": "https://www.reuters.com/world/middle-east/status-us-iran-talks-uncertain-ship-struck-hormuz-2026-08-04/",